{
  "schema_version": "historical-location.v1",
  "location_id": "gujranwala_camp",
  "kind": "camp",
  "label": "Gujranwala household camp (greybox)",
  "summary": "Authored greybox camp node on the approach into Gujranwala settlement. Represents household staging outside the walled-town motif, not a surveyed 1790 encampment plan.",
  "region": "rechna_doab_west_punjab",
  "household_context": "sukerchakia",
  "connects": [
    "gujranwala_fort_road",
    "gujranwala_settlement",
    "sukarchakia_field_camp"
  ],
  "evidence": [
    {
      "source": "game_canon.mahan_interlude_gujranwala_camp",
      "confidence": "none",
      "evidence_class": "C",
      "note": "Gameplay column node between fort-road approach and settlement; not a documentary camp diary."
    },
    {
      "source": "nominated_secondary_context (Sukerchakia HQ at Gujranwala implies local staging)",
      "confidence": "low",
      "evidence_class": "B",
      "note": "Staging near home-ground is reconstructed context only; exact site is authored."
    }
  ],
  "canon_class": "game_canon",
  "gameplay": {
    "profile_scope": "mahan.v1",
    "role": "column_node",
    "notes": "Playable march-graph node toward Gujranwala settlement."
  }
}
